{
  "subpath": "stream#stream.Transform",
  "nodeSpecifier": "node:stream",
  "status": "supported",
  "exports": [
    {
      "name": "destroy",
      "kind": "fn",
      "cancelCategory": null,
      "callPath": null,
      "nodeSignal": {
        "documented": false,
        "since": null,
        "probed": null,
        "sinceByMajor": null
      },
      "wrapper": "passthrough",
      "failures": [],
      "minMajor": null,
      "gate": null,
      "runtime": {
        "deno": "unverified",
        "bun": "unverified"
      },
      "notes": "inherited Transform prototype member, structural re-export only"
    }
  ]
}
