{
  "subpath": "crypto#Cipheriv",
  "nodeSpecifier": "node:crypto",
  "status": "planned",
  "exports": [
    {
      "name": "final",
      "kind": "fn",
      "cancelCategory": null,
      "nodeSignal": {
        "documented": false,
        "since": null,
        "probed": null
      },
      "wrapper": "passthrough",
      "failures": [],
      "minMajor": null,
      "gate": null,
      "runtime": {
        "deno": "method",
        "bun": "method"
      },
      "notes": "synchronous instance method, re-exported unchanged; no promise to cancel",
      "callPath": "sync"
    },
    {
      "name": "getAuthTag",
      "kind": "fn",
      "cancelCategory": null,
      "nodeSignal": {
        "documented": false,
        "since": null,
        "probed": null
      },
      "wrapper": "passthrough",
      "failures": [],
      "minMajor": null,
      "gate": null,
      "runtime": {
        "deno": "method",
        "bun": "method"
      },
      "notes": "synchronous instance method, re-exported unchanged; no promise to cancel",
      "callPath": "sync"
    },
    {
      "name": "setAAD",
      "kind": "fn",
      "cancelCategory": null,
      "nodeSignal": {
        "documented": false,
        "since": null,
        "probed": null
      },
      "wrapper": "passthrough",
      "failures": [],
      "minMajor": null,
      "gate": null,
      "runtime": {
        "deno": "method",
        "bun": "method"
      },
      "notes": "synchronous instance method, re-exported unchanged; no promise to cancel",
      "callPath": "sync"
    },
    {
      "name": "setAutoPadding",
      "kind": "fn",
      "cancelCategory": null,
      "nodeSignal": {
        "documented": false,
        "since": null,
        "probed": null
      },
      "wrapper": "passthrough",
      "failures": [],
      "minMajor": null,
      "gate": null,
      "runtime": {
        "deno": "method",
        "bun": "method"
      },
      "notes": "synchronous instance method, re-exported unchanged; no promise to cancel",
      "callPath": "sync"
    },
    {
      "name": "update",
      "kind": "fn",
      "cancelCategory": null,
      "nodeSignal": {
        "documented": false,
        "since": null,
        "probed": null
      },
      "wrapper": "passthrough",
      "failures": [],
      "minMajor": null,
      "gate": null,
      "runtime": {
        "deno": "method",
        "bun": "method"
      },
      "notes": "synchronous instance method, re-exported unchanged; no promise to cancel",
      "callPath": "sync"
    }
  ]
}
